{
  "$schema": "http://json-schema.org/draft-07/schema#",
  "title": "Module Configuration",
  "description": "Configuration schema for application modules",
  "type": "object",
  "required": ["id", "name", "version"],
  "properties": {
    "$schema": {
      "type": "string",
      "description": "JSON Schema reference"
    },
    "id": {
      "type": "string",
      "pattern": "^[a-z][a-z0-9_]*$",
      "description": "Unique module identifier (lowercase, underscores)"
    },
    "name": {
      "type": "string",
      "description": "Human-readable module name"
    },
    "description": {
      "type": "string",
      "description": "Brief description of the module"
    },
    "version": {
      "type": "string",
      "pattern": "^\\d+\\.\\d+\\.\\d+$",
      "description": "Semantic version (e.g., 1.0.0)"
    },
    "author": {
      "type": "string",
      "description": "Module author or team"
    },
    "license": {
      "type": "string",
      "description": "License type"
    },
    "icon": {
      "type": "string",
      "description": "FontAwesome icon name for the module"
    },
    "tags": {
      "type": "array",
      "items": { "type": "string" },
      "description": "Categorization tags"
    },
    "enabled": {
      "type": "boolean",
      "default": true,
      "description": "Whether the module is active"
    },
    "priority": {
      "type": "integer",
      "default": 100,
      "description": "Load order priority (lower = earlier)"
    },
    "dependencies": {
      "type": "object",
      "properties": {
        "requires": {
          "type": "array",
          "items": { "type": "string" },
          "description": "Required module IDs"
        },
        "optional": {
          "type": "array",
          "items": { "type": "string" },
          "description": "Optional module IDs for enhanced features"
        },
        "conflicts": {
          "type": "array",
          "items": { "type": "string" },
          "description": "Incompatible module IDs"
        }
      }
    },
    "settings": {
      "type": "object",
      "properties": {
        "tabs": {
          "type": "array",
          "items": { "$ref": "#/definitions/settingsTab" },
          "description": "Settings page tabs"
        },
        "keys": {
          "type": "string",
          "description": "Reference to keys export (e.g., 'AUTH_KEYS')"
        }
      }
    },
    "menu": {
      "type": "array",
      "items": { "$ref": "#/definitions/menuItem" },
      "description": "Navigation menu items"
    },
    "routes": {
      "type": "array",
      "items": { "$ref": "#/definitions/route" },
      "description": "Custom routes/pages"
    },
    "api": {
      "type": "object",
      "properties": {
        "endpoints": {
          "type": "array",
          "items": { "$ref": "#/definitions/apiEndpoint" }
        },
        "middleware": {
          "type": "array",
          "items": { "type": "string" }
        }
      }
    },
    "permissions": {
      "type": "array",
      "items": { "$ref": "#/definitions/permission" },
      "description": "Module-specific permissions"
    },
    "hooks": {
      "type": "object",
      "properties": {
        "onInstall": { "type": "string" },
        "onUninstall": { "type": "string" },
        "onEnable": { "type": "string" },
        "onDisable": { "type": "string" },
        "onUpgrade": { "type": "string" }
      },
      "description": "Lifecycle hook handlers"
    },
    "widgets": {
      "type": "array",
      "items": { "$ref": "#/definitions/widget" },
      "description": "Dashboard widgets"
    },
    "slots": {
      "type": "array",
      "items": { "$ref": "#/definitions/slotContribution" },
      "description": "Components this module contributes into named slots exposed by other modules"
    },
    "extensionPoints": {
      "type": "array",
      "items": { "$ref": "#/definitions/extensionPoint" },
      "description": "Named extension points this module (the host) exposes for satellite modules to contribute into (e.g. 'ai:provider')"
    },
    "extensions": {
      "type": "array",
      "items": { "$ref": "#/definitions/extensionContribution" },
      "description": "Contributions this module makes into extension points exposed by other (host) modules"
    },
    "apiRoutes": {
      "type": "array",
      "description": "Tenant API endpoints owned by this module, served by the catch-all dispatcher",
      "items": {
        "type": "object",
        "required": ["path", "handler"],
        "properties": {
          "path": { "type": "string", "description": "URL path, e.g. '/api/store/products/[productId]'" },
          "handler": { "type": "string", "description": "Handler module id, e.g. 'store/server/store-products.route'" }
        }
      }
    },
    "exports": {
      "type": "object",
      "additionalProperties": { "type": "string" },
      "description": "Named exports from this module (e.g., components, utilities)"
    },
    "settingKeys": {
      "type": "array",
      "items": { "type": "string" },
      "description": "Setting keys owned by this module"
    },
    "homepage": {
      "type": "string",
      "description": "Module/plugin website or documentation URL"
    },
    "sandbox": {
      "type": "object",
      "description": "For untrusted community plugins: declares the isolated runtime + the capabilities/limits the plugin requests. Reviewed and approved before publish. First-party modules omit this (they run trusted, in-process).",
      "required": ["runtime", "capabilities"],
      "properties": {
        "runtime": {
          "type": "string",
          "enum": ["isolated"],
          "description": "Execution model. 'isolated' = V8 isolate with brokered capabilities, no direct DB/fs/net."
        },
        "capabilities": {
          "type": "array",
          "items": { "type": "string", "enum": ["data", "http", "settings", "secrets", "storage", "events"] },
          "description": "Host capabilities the plugin may use. Only granted ones are injected."
        },
        "httpAllowlist": {
          "type": "array",
          "items": { "type": "string" },
          "description": "Hostnames the plugin's http.fetch may reach (SSRF-guarded). Empty = none."
        },
        "limits": {
          "type": "object",
          "properties": {
            "memoryMb": { "type": "integer" },
            "timeoutMs": { "type": "integer" },
            "httpTimeoutMs": { "type": "integer" },
            "httpMaxBytes": { "type": "integer" }
          }
        }
      }
    }
  },
  "definitions": {
    "settingsTab": {
      "type": "object",
      "required": ["id", "label", "component"],
      "properties": {
        "id": { "type": "string" },
        "label": { "type": "string" },
        "icon": { "type": "string" },
        "component": { "type": "string", "description": "Relative path to component" },
        "order": { "type": "integer", "default": 100 },
        "scope": {
          "type": "string",
          "enum": ["system", "tenant", "both"],
          "default": "system"
        },
        "keys": {
          "oneOf": [
            { "type": "string" },
            { "type": "array", "items": { "type": "string" } }
          ]
        },
        "permissions": {
          "type": "array",
          "items": { "type": "string" }
        }
      }
    },
    "menuItem": {
      "type": "object",
      "required": ["id", "label", "href"],
      "properties": {
        "id": { "type": "string" },
        "label": { "type": "string" },
        "href": { "type": "string" },
        "icon": { "type": "string" },
        "order": { "type": "integer", "default": 100 },
        "scope": {
          "type": "string",
          "enum": ["system", "tenant", "both"],
          "default": "system"
        },
        "permissions": {
          "type": "array",
          "items": { "type": "string" }
        },
        "group": {
          "type": "string",
          "description": "Sidebar section label this item is grouped under (e.g. 'Content', 'Commerce')"
        },
        "workspace": {
          "type": "string",
          "description": "Top-level workspace this item belongs to (e.g. 'content', 'commerce', 'crm', 'operations', 'system'). Controls which workspace tab reveals it in the sidebar."
        },
        "children": {
          "type": "array",
          "items": { "$ref": "#/definitions/menuItem" }
        },
        "badge": {
          "type": "object",
          "properties": {
            "type": { "type": "string", "enum": ["count", "dot", "text"] },
            "source": { "type": "string" }
          }
        }
      }
    },
    "route": {
      "type": "object",
      "required": ["path", "component"],
      "properties": {
        "path": { "type": "string" },
        "component": { "type": "string" },
        "layout": { "type": "string" },
        "middleware": { "type": "array", "items": { "type": "string" } },
        "permissions": { "type": "array", "items": { "type": "string" } }
      }
    },
    "apiEndpoint": {
      "type": "object",
      "required": ["path", "handler"],
      "properties": {
        "path": { "type": "string" },
        "method": {
          "type": "string",
          "enum": ["GET", "POST", "PUT", "PATCH", "DELETE"],
          "default": "GET"
        },
        "handler": { "type": "string" },
        "middleware": { "type": "array", "items": { "type": "string" } },
        "permissions": { "type": "array", "items": { "type": "string" } },
        "rateLimit": {
          "type": "object",
          "properties": {
            "requests": { "type": "integer" },
            "window": { "type": "string" }
          }
        }
      }
    },
    "permission": {
      "type": "object",
      "required": ["id", "name"],
      "properties": {
        "id": { "type": "string" },
        "name": { "type": "string" },
        "description": { "type": "string" },
        "group": { "type": "string" }
      }
    },
    "widget": {
      "type": "object",
      "required": ["id", "component"],
      "properties": {
        "id": { "type": "string" },
        "name": { "type": "string" },
        "component": { "type": "string" },
        "scope": { "type": "string", "enum": ["system", "tenant", "both"] },
        "size": { "type": "string", "enum": ["small", "medium", "large", "full"] },
        "order": { "type": "integer" },
        "permissions": { "type": "array", "items": { "type": "string" } }
      }
    },
    "extensionPoint": {
      "type": "object",
      "required": ["id", "kind"],
      "properties": {
        "id": {
          "type": "string",
          "pattern": "^[a-z][a-z0-9_]*:[a-z][a-z0-9_]*$",
          "description": "Globally-unique, host-namespaced point id, e.g. 'ai:provider', 'payment:gateway'"
        },
        "kind": {
          "type": "string",
          "enum": ["provider", "hook"],
          "description": "provider = a keyed backend implementation; hook = a fn invoked at this named point"
        },
        "description": { "type": "string" }
      }
    },
    "extensionContribution": {
      "type": "object",
      "required": ["point", "export"],
      "properties": {
        "point": {
          "type": "string",
          "description": "Target extension point id exposed by a host, e.g. 'ai:provider'"
        },
        "key": {
          "type": "string",
          "pattern": "^[a-z][a-z0-9_]*$",
          "description": "Stable key for provider contributions (e.g. 'openai'). Required for provider points, ignored for hooks."
        },
        "export": {
          "type": "string",
          "description": "Server export id resolved to '@kuraykaraaslan/<export>', e.g. 'ai_openai/server/openai.extension'. Must be listed in the module's package.json exports."
        },
        "order": { "type": "integer", "default": 100 },
        "scope": {
          "type": "string",
          "enum": ["system", "tenant", "both"],
          "default": "both"
        },
        "permissions": { "type": "array", "items": { "type": "string" } },
        "metadata": {
          "type": "object",
          "additionalProperties": true,
          "description": "Static metadata merged into the runtime contribution record (label, models, etc.) — readable without importing the contribution's code."
        }
      }
    },
    "slotContribution": {
      "type": "object",
      "required": ["slot", "component"],
      "properties": {
        "slot": {
          "type": "string",
          "description": "Target slot name exposed by a host, e.g. 'user.profile.tabs'"
        },
        "component": {
          "type": "string",
          "description": "Contributed component id, e.g. 'payment/ui/BillingProfileTab'"
        },
        "order": { "type": "integer", "default": 100 },
        "scope": {
          "type": "string",
          "enum": ["system", "tenant", "both"],
          "default": "both"
        },
        "permissions": { "type": "array", "items": { "type": "string" } },
        "props": {
          "type": "object",
          "additionalProperties": true,
          "description": "Static props merged into the rendered component"
        }
      }
    }
  }
}
