{
  "$schema": "../module.schema.json",
  "id": "sms_clickatell",
  "name": "SMS — Clickatell",
  "description": "Clickatell SMS backend for the notification_sms module.",
  "version": "1.0.0",
  "icon": "fas fa-comment-sms",
  "tags": ["notifications", "sms", "provider"],
  "priority": 63,
  "enabled": true,
  "author": "Kuray Karaaslan",
  "license": "CC-BY-NC-ND-4.0",
  "dependencies": { "requires": ["notification_sms", "env", "setting"] },
  "extensions": [
    {
      "point": "sms:provider",
      "key": "clickatell",
      "export": "sms_clickatell/server/sms.extension",
      "metadata": { "label": "Clickatell", "regions": [] }
    }
  ]
}
