{
  "$schema": "../module.schema.json",
  "id": "blog",
  "name": "Blog",
  "description": "Tenant-scoped blog with posts, categories and threaded comments. Posts have a draft/published/archived lifecycle; comment moderation and anonymous-comment policy are per-tenant settings.",
  "version": "1.0.0",
  "icon": "fas fa-newspaper",
  "tags": [
    "blog",
    "content",
    "cms",
    "comments",
    "moderation"
  ],
  "priority": 44,
  "dependencies": {
    "requires": [
      "db",
      "env",
      "redis",
      "logger",
      "setting"
    ]
  },
  "author": "Kuray Karaaslan",
  "homepage": "https://github.com/kuraykaraaslan/next-boilerplate/tree/main/modules/blog",
  "license": "CC-BY-NC-ND-4.0",
  "menu": [
    {
      "id": "blog-posts",
      "label": "Posts",
      "href": "/admin/blog/posts",
      "icon": "fas fa-newspaper",
      "group": "Blog",
      "workspace": "content",
      "order": 10,
      "scope": "tenant"
    },
    {
      "id": "blog-categories",
      "label": "Categories",
      "href": "/admin/blog/categories",
      "icon": "fas fa-folder-open",
      "group": "Blog",
      "workspace": "content",
      "order": 20,
      "scope": "tenant"
    },
    {
      "id": "blog-comments",
      "label": "Comments",
      "href": "/admin/blog/comments",
      "icon": "fas fa-comments",
      "group": "Blog",
      "workspace": "content",
      "order": 30,
      "scope": "tenant"
    }
  ],
  "routes": [
    {
      "path": "/admin/blog/comments",
      "component": "blog/ui/blog-comments.page"
    },
    {
      "path": "/admin/blog/categories",
      "component": "blog/ui/blog-categories.page"
    },
    {
      "path": "/admin/blog/posts/[postId]",
      "component": "blog/ui/blog-posts-post-id.page"
    },
    {
      "path": "/admin/blog/posts",
      "component": "blog/ui/blog-posts.page"
    }
  ],
  "apiRoutes": [
    {
      "path": "/api/blog/categories/[categoryId]",
      "handler": "blog/server/blog-categories-category-id.route"
    },
    {
      "path": "/api/blog/categories",
      "handler": "blog/server/blog-categories.route"
    },
    {
      "path": "/api/blog/comments/[commentId]",
      "handler": "blog/server/blog-comments-comment-id.route"
    },
    {
      "path": "/api/blog/posts/[postId]/comments",
      "handler": "blog/server/blog-posts-post-id-comments.route"
    },
    {
      "path": "/api/blog/posts/[postId]",
      "handler": "blog/server/blog-posts-post-id.route"
    },
    {
      "path": "/api/blog/posts",
      "handler": "blog/server/blog-posts.route"
    }
  ]
}
