{
  "$schema": "../module.schema.json",
  "id": "notification_sms",
  "name": "SMS Notifications",
  "description": "Pluggable SMS sender (Twilio, Nexmo, Clickatell, NetGSM).",
  "version": "1.0.0",
  "icon": "fas fa-message",
  "tags": [
    "notifications",
    "sms"
  ],
  "priority": 30,
  "dependencies": {
    "requires": [
      "redis",
      "env",
      "setting"
    ]
  },
  "settings": {
    "keys": "SMS_KEYS"
  },
  "settingKeys": [
    "SMS_KEYS"
  ],
  "author": "Kuray Karaaslan",
  "homepage": "https://github.com/kuraykaraaslan/next-boilerplate/tree/main/modules/notification_sms",
  "license": "CC-BY-NC-ND-4.0"
}
