{
  "$schema": "../module.schema.json",
  "id": "redis_idempotency",
  "name": "Idempotency Keys",
  "description": "Redis-backed idempotency-key store for safely retryable POST/PATCH operations.",
  "version": "1.0.0",
  "icon": "fas fa-key",
  "tags": [
    "infrastructure",
    "reliability"
  ],
  "priority": 5,
  "dependencies": {
    "requires": [
      "redis",
      "env"
    ]
  },
  "exports": {
    "RedisIdempotencyService": "redis_idempotency.service.ts"
  },
  "author": "Kuray Karaaslan",
  "homepage": "https://github.com/kuraykaraaslan/next-boilerplate/tree/main/modules/redis_idempotency",
  "license": "CC-BY-NC-ND-4.0"
}
