{
  "$schema": "../module.schema.json",
  "id": "esign_smart_id",
  "name": "e-Signature — Smart-ID",
  "description": "Smart-ID national e-signature / eID provider for the e_signature module.",
  "version": "1.0.0",
  "icon": "fas fa-signature",
  "tags": ["e_signature", "eid", "provider"],
  "priority": 72,
  "enabled": true,
  "author": "Kuray Karaaslan",
  "license": "CC-BY-NC-ND-4.0",
  "dependencies": { "requires": ["e_signature", "env", "setting"] },
  "extensions": [
    {
      "point": "esign:provider",
      "key": "smart_id",
      "export": "esign_smart_id/server/esign.extension",
      "metadata": { "label": "Smart-ID", "countries": ["EE","LV","LT"] }
    }
  ]
}
