{
  "$schema": "../module.schema.json",
  "id": "sms_nexmo",
  "name": "SMS — Vonage (Nexmo)",
  "description": "Vonage (Nexmo) SMS backend for the notification_sms module.",
  "version": "1.0.0",
  "icon": "fas fa-comment-sms",
  "tags": ["notifications", "sms", "provider"],
  "priority": 64,
  "enabled": true,
  "author": "Kuray Karaaslan",
  "license": "CC-BY-NC-ND-4.0",
  "dependencies": { "requires": ["notification_sms", "env", "setting"] },
  "extensions": [
    {
      "point": "sms:provider",
      "key": "nexmo",
      "export": "sms_nexmo/server/sms.extension",
      "metadata": { "label": "Vonage (Nexmo)", "regions": [] }
    }
  ]
}
