{
  "$schema": "../module.schema.json",
  "id": "auth_acs_uz_oneid",
  "name": "OneID (UZ)",
  "description": "OneID national-identity provider, contributed into the auth_acs:provider extension point.",
  "version": "1.0.0",
  "icon": "fas fa-id-card",
  "tags": [
    "identity",
    "auth",
    "acs",
    "government",
    "provider"
  ],
  "priority": 18,
  "dependencies": {
    "requires": [
      "auth_acs",
      "auth_saml",
      "auth_oidc",
      "env",
      "common"
    ]
  },
  "author": "Kuray Karaaslan",
  "homepage": "https://github.com/kuraykaraaslan/next-boilerplate/tree/main/modules/auth_acs_uz_oneid",
  "license": "CC-BY-NC-ND-4.0",
  "extensions": [
    {
      "point": "auth_acs:provider",
      "key": "uz_oneid",
      "export": "auth_acs_uz_oneid/server/uz_oneid.extension",
      "metadata": {
        "label": "OneID",
        "country": "UZ"
      }
    }
  ]
}
