{
  "$schema": "../module.schema.json",
  "id": "storage_minio",
  "name": "Storage — MinIO",
  "description": "MinIO storage backend for the storage module.",
  "version": "1.0.0",
  "icon": "fas fa-hard-drive",
  "tags": ["storage", "provider"],
  "priority": 44,
  "enabled": true,
  "author": "Kuray Karaaslan",
  "license": "CC-BY-NC-ND-4.0",
  "dependencies": { "requires": ["storage", "env", "setting"] },
  "extensions": [
    {
      "point": "storage:provider",
      "key": "minio",
      "export": "storage_minio/server/storage.extension",
      "metadata": { "label": "MinIO" }
    }
  ]
}
