{
  "$schema": "../module.schema.json",
  "id": "approval",
  "name": "Approval Queue",
  "description": "Generic, entity-agnostic moderation / approval queue. Any owning module can route an entity through human review via the queue (keyed by entityType + entityId) with a tamper-evident per-tenant decision hash chain and an in-memory decision-handler hook. Open items are PENDING / IN_REVIEW / ESCALATED; terminal items are APPROVED / REJECTED, with a partial unique index enforcing at most one open item per entity and SLA-by-priority due dates. Every decision is recorded in the append-only audit log; submitters are notified in-app and webhooks fire on each lifecycle event.",
  "version": "1.0.0",
  "icon": "fas fa-clipboard-check",
  "tags": [
    "approval",
    "moderation",
    "queue",
    "review",
    "back-office"
  ],
  "priority": 49,
  "dependencies": {
    "requires": [
      "db",
      "env",
      "logger",
      "common",
      "webhook",
      "audit_log",
      "notification_inapp"
    ]
  },
  "author": "Kuray Karaaslan",
  "homepage": "https://github.com/kuraykaraaslan/next-boilerplate/tree/main/modules/approval",
  "license": "CC-BY-NC-ND-4.0",
  "menu": [
    {
      "id": "approvals",
      "label": "Approvals",
      "href": "/admin/approvals",
      "icon": "fas fa-clipboard-check",
      "group": "Operations",
      "workspace": "operations",
      "order": 10,
      "scope": "tenant"
    }
  ],
  "routes": [
    {
      "path": "/admin/approvals",
      "component": "approval/ui/approvals.page"
    }
  ],
  "apiRoutes": [
    {
      "path": "/api/approvals/[approvalItemId]",
      "handler": "approval/server/approvals-approval-item-id.route"
    },
    {
      "path": "/api/approvals",
      "handler": "approval/server/approvals.route"
    }
  ]
}
