{
  "$schema": "../module.schema.json",
  "id": "auth_sso_alipay",
  "name": "Alipay SSO",
  "description": "Alipay OAuth/OIDC provider, contributed into the auth_sso:provider extension point.",
  "version": "1.0.0",
  "icon": "fab fa-alipay",
  "tags": [
    "identity",
    "auth",
    "sso",
    "provider"
  ],
  "priority": 17,
  "dependencies": {
    "requires": [
      "auth_sso",
      "env",
      "common"
    ]
  },
  "author": "Kuray Karaaslan",
  "homepage": "https://github.com/kuraykaraaslan/next-boilerplate/tree/main/modules/auth_sso_alipay",
  "license": "CC-BY-NC-ND-4.0",
  "extensions": [
    {
      "point": "auth_sso:provider",
      "key": "alipay",
      "export": "auth_sso_alipay/server/alipay.extension",
      "metadata": {
        "label": "Alipay"
      }
    }
  ]
}
